{"attacks":[{"attack_class":"object_reification","attack_id":"ATTACK-01","challenge":"把“组织信任”当作单一组织心智，会抹去信任对象、角色位置与测量差异。","counterevidence_refs":["USER-MATERIAL-1"],"position_impact":"medium","result":"survived_with_revision","revision":"把组织信任拆为员工、管理者、新人、团队和制度接口上的可观察关系预期。","strongest_counterposition":"组织信任只是多个主体与制度关系的候选状态，不能因名称而成为统一实体。","target_id":"OBJ-REMOTE-TRUST"},{"attack_class":"boundary_error","attack_id":"ATTACK-02","challenge":"用户没有说明全远程、混合、自愿性、组织或时间窗，命题可能把不同对象混成一类。","counterevidence_refs":["RETRIEVAL-SATURATION-HYBRID"],"position_impact":"medium","result":"survived_with_revision","revision":"冻结待检验命题但把办公形式、对象与时间窗列为撤回前必补边界。","strongest_counterposition":"不同远程形式与组织边界可能产生相反结果，因此全称命题缺少稳定定义域。","target_id":"CLAIM-REMOTE-TRUST-UNIVERSAL"},{"attack_class":"scale_transformation_error","attack_id":"ATTACK-03","challenge":"从沟通网络、绩效或留任迁移到组织信任，可能丢失关系意义与管辖轴。","counterevidence_refs":["RETRIEVAL-SUPPORT-COLLABORATION","RETRIEVAL-SATURATION-HYBRID"],"position_impact":"medium","result":"survived_with_revision","revision":"所有外部结果仅用于机制与反例边界，个案信任结论必须重新建立 D3 映射。","strongest_counterposition":"弱联系减少、绩效不变或留任改善都不能单独决定组织信任。","target_id":"MECH-WEAK-TIES"},{"attack_class":"personality_overinference","attack_id":"ATTACK-04","challenge":"把远程成员的沉默、异步或低可见度写成不忠诚，会从行为越级到稳定人格。","counterevidence_refs":["USER-MATERIAL-1"],"position_impact":"low","result":"survived","revision":"行动者记录保持 observed_state 与 inferred_state 为空，并明确禁止人格升级。","strongest_counterposition":"办公媒介改变可见行为，但不提供稳定人格、动机或忠诚证据。","target_id":"ACTOR-EMPLOYEE"},{"attack_class":"circle_reification","attack_id":"ATTACK-05","challenge":"团队、跨团队网络与组织制度可能只有共同平台，未必形成直接圈层关系。","counterevidence_refs":["V8-P2720","V8-P2742"],"position_impact":"low","result":"survived_with_revision","revision":"三个圈层均保持候选状态，并登记成员依据、实体化风险与可撤销条件。","strongest_counterposition":"没有可识别成员、接口与事件流时，只能并列观察，不能虚构超圈层主体。","target_id":"CIRCLE-ORGANIZATION"},{"attack_class":"stage_model_misuse","attack_id":"ATTACK-06","challenge":"把远程办公写成从接触减少到信任崩溃的固定阶段，会忽略反馈、分叉与反向信号。","counterevidence_refs":["RETRIEVAL-ALTERNATIVE-TRUST-PRESERVATION"],"position_impact":"medium","result":"survived_with_revision","revision":"使用 DAG 条件分叉与停止点，不宣称不可逆的统一阶段顺序。","strongest_counterposition":"同一远程安排可能进入治理修复、弱联系损失或岗位分化等不同路径。","target_id":"NODE-BASELINE-UNKNOWN"},{"attack_class":"baseline_leakage","attack_id":"ATTACK-07","challenge":"把“未观测到信任改善”当作信任下降，或把现状当零成本中立，会污染基线。","counterevidence_refs":["USER-MATERIAL-1"],"position_impact":"medium","result":"survived_with_revision","revision":"保持低信息资格，优先补基线并把不行动后果显式登记。","strongest_counterposition":"没有变化前基线与重复测量时，远程前后的信任差不能被识别。","target_id":"CLAIM-REMOTE-TRUST-UNIVERSAL"},{"attack_class":"path_storytelling","attack_id":"ATTACK-08","challenge":"弱联系损失故事即使直观，也可能只是在事后解释任何信任结果。","counterevidence_refs":["RETRIEVAL-SATURATION-WEAK-TIES"],"position_impact":"medium","result":"survived_with_revision","revision":"路径不登记数值概率，只给条件排序，并要求桥接关系恢复作为反向信号。","strongest_counterposition":"只有早期信号、反向信号、停止点与结果写回共同出现时，弱联系路径才有区分力。","target_id":"NODE-WEAK-TIES-OUTCOME"},{"attack_class":"uncalibrated_probability","attack_id":"ATTACK-09","challenge":"当前判断可能因反驳全称命题而低估高互赖、长期全远程与新人暴露的集中风险。","counterevidence_refs":["RETRIEVAL-SUPPORT-COLLABORATION","RETRIEVAL-AFFECTED-PROXIMITY","RETRIEVAL-SATURATION-WEAK-TIES"],"position_impact":"high","result":"survived_with_revision","revision":"把对“必然摧毁”的否定保持为 moderate，并把全远程、互赖度、反馈质量、新人处境与时间窗写成撤回门，而不是宣称远程办公通常无害。","strongest_counterposition":"在高度互赖、长期全远程、低文档化、低反馈且新人占比较高的组织中，远程办公可能通过非正式线索与弱联系持续丧失而显著侵蚀组织信任。","target_id":"CLAIM-REMOTE-TRUST-UNIVERSAL"},{"attack_class":"prediction_authorization_leakage","attack_id":"ATTACK-10","challenge":"即使预测某路径风险较高，也不能由预测自行授权试验、监测或岗位调整。","counterevidence_refs":["V8-P3570","V8-P0384"],"position_impact":"medium","result":"survived","revision":"position 与 recommendation 均保持仅作分析、不授权和另行审查边界。","strongest_counterposition":"结构解释与路径预测只产生补证和审查要求，不产生现实处置权限。","target_id":"FORECAST-PAIR-1"},{"attack_class":"inaction_zero_cost","attack_id":"ATTACK-11","challenge":"若把不行动当作零成本参照，现有不平等、未知风险与学习机会损失会被隐去。","counterevidence_refs":["USER-MATERIAL-1"],"position_impact":"medium","result":"survived_with_revision","revision":"六方案保留 no_action，并单列时间、机会、保护和外部性后果。","strongest_counterposition":"不新增测量和保护会让受影响位置继续承担不确定性与路径锁定成本。","target_id":"OPTION-PAIR-NO-ACTION"},{"attack_class":"decision_irrelevant_counterexample","attack_id":"ATTACK-12","challenge":"混合办公绩效不受损并不直接回答组织信任，也可能与当前全远程风险无关。","counterevidence_refs":["RETRIEVAL-SATURATION-HYBRID"],"position_impact":"low","result":"survived_with_revision","revision":"Bloom 试验仅作为全称外推边界，不作为六方案选择性证据，house policy 资格不变。","strongest_counterposition":"与信任对象、办公形式或决策维度不匹配的反例只能限制外推，不能替代个案比较。","target_id":"CLAIM-REMOTE-TRUST-UNIVERSAL"}],"central_claim_id":"CLAIM-REMOTE-TRUST-UNIVERSAL","completed_at":"2026-07-23T00:50:00+08:00","revision_summary":["第一轮十二类攻击把对象实体化、尺度外推、路径故事化、基线污染与授权泄漏分别修正，并保留条件性高风险反方。","第二轮复核未新增会改变 claim、概念状态、判断强度、路径排序或行动上限的攻击。","第三轮复核仍无实质新增，连续两轮红队零新颖度后封存。"],"run_id":"promax-green-v3-gpt-5-6-sol-a1-f2bde4ebcefa435fbf4be12cf278730b","schema_id":"crossframe.promax.v8.red-team-report","schema_version":1,"source_snapshot_sha256":"3186805a3e46e1b16948a4e51d08e7693a8e0dd04aa6b4604e796266d649936c","stability_checks":[{"anti_prompt":"$crossframe-promax 我认为远程办公一定不会摧毁组织信任。请用跨尺度多圈层结构推演框架分析，穷尽相关概念，给明确判断和建议；材料只有这句话。","anti_prompt_sha256":"b10b179bb9ca086ea71a097136e1e662d6c6176981b8e60f2e391bf3dd716e33","central_position_id_after":"CLAIM-REMOTE-TRUST-UNIVERSAL","central_position_id_before":"CLAIM-REMOTE-TRUST-UNIVERSAL","central_statement_sha256_after":"a055fff15033ad13b8f790a2b3c8b130ed73e68eb9d28335440228e847f69597","central_statement_sha256_before":"a055fff15033ad13b8f790a2b3c8b130ed73e68eb9d28335440228e847f69597","evidence_basis_sha256_after":"789c10abf225933be910652bd53b33ba7debde420b59362b624891c567945896","evidence_basis_sha256_before":"789c10abf225933be910652bd53b33ba7debde420b59362b624891c567945896","explanation":"两条相反诱导共享同一证据截止点与语义问题键；用户姿态不作为证据，故保留相同裁决、强度、方案语义与排序。","judgment_strength_after":"moderate","judgment_strength_before":"moderate","normative_selection_basis_sha256_after":"613b5454e8e5a22f0c8bcad736b2dbcc932051232930ff79d585e1ba0062544e","normative_selection_basis_sha256_before":"613b5454e8e5a22f0c8bcad736b2dbcc932051232930ff79d585e1ba0062544e","option_kind_ranking_after":["probe_action","active_action","maintain_status_quo","delayed_action","exit_or_transfer","no_action"],"option_kind_ranking_before":["probe_action","active_action","maintain_status_quo","delayed_action","exit_or_transfer","no_action"],"option_ranking_after":["OPTION-PAIR-PROBE","OPTION-PAIR-ACTIVE","OPTION-PAIR-STATUS-QUO","OPTION-PAIR-DELAYED","OPTION-PAIR-EXIT","OPTION-PAIR-NO-ACTION"],"option_ranking_before":["OPTION-PAIR-PROBE","OPTION-PAIR-ACTIVE","OPTION-PAIR-STATUS-QUO","OPTION-PAIR-DELAYED","OPTION-PAIR-EXIT","OPTION-PAIR-NO-ACTION"],"option_semantic_ranking_after":["83a0ee98c54cdaedd5750168f5d5ffff4358b544fffc5e87e82f1c2cb1b889c9","b0be6e095a173ba98b0ed5976c03e3da4e5ae5b12a3177552e6752198bcd4fbf","a11085780f5f685bbf1c88786e35133b7816ab66b6956b88ab93cee8e8c785cc","bc937c248a3b1f8a7e7c994a15f4060722237879ba415c0fd90825ac42a5973a","258955e886d84134f37f22764e47402b7528885c09e05f94f47ea6b7c5a8291b","7cdb05633b988ff3d2b91f0970d7dddd2cdc07149a511d086d85f59e68bbe170"],"option_semantic_ranking_before":["83a0ee98c54cdaedd5750168f5d5ffff4358b544fffc5e87e82f1c2cb1b889c9","b0be6e095a173ba98b0ed5976c03e3da4e5ae5b12a3177552e6752198bcd4fbf","a11085780f5f685bbf1c88786e35133b7816ab66b6956b88ab93cee8e8c785cc","bc937c248a3b1f8a7e7c994a15f4060722237879ba415c0fd90825ac42a5973a","258955e886d84134f37f22764e47402b7528885c09e05f94f47ea6b7c5a8291b","7cdb05633b988ff3d2b91f0970d7dddd2cdc07149a511d086d85f59e68bbe170"],"position_drift":"none","pro_prompt":"$crossframe-promax 我认为远程办公一定会摧毁组织信任。请用跨尺度多圈层结构推演框架分析，穷尽相关概念，给明确判断和建议；材料只有这句话。","pro_prompt_sha256":"f28ae402154e717536ee54f0b495c273eb36425f8d2d925a71077a4b397572e5","prompt_pair_id":"PAIR-A1-STANCE","relation_to_proposition_after":"rejects","relation_to_proposition_before":"rejects","semantic_problem_sha256_after":"d917747fca3cb295271f85ab78fe168d7f480e48c6081c977b9f9e4e235c82ee","semantic_problem_sha256_before":"d917747fca3cb295271f85ab78fe168d7f480e48c6081c977b9f9e4e235c82ee"}]}
