{"attacks":[{"attack_class":"object_reification","attack_id":"ATTACK-01","challenge":"object_reification：检验是否把材料中的地点、组织、路径或建议边界过度实化、越界或确定化。","counterevidence_refs":["USER-A1"],"position_impact":"medium","result":"survived","revision":"保留边界：object_reification 不把用户断言或一般研究升级为该组织事实。","strongest_counterposition":"object_reification 提醒：远程办公与组织信任之间的关系不能在缺失组织内记录时被写成单一确定故事。","target_id":"CLAIM-REMOTE-TRUST-INEVITABILITY"},{"attack_class":"boundary_error","attack_id":"ATTACK-02","challenge":"boundary_error：检验是否把材料中的地点、组织、路径或建议边界过度实化、越界或确定化。","counterevidence_refs":["USER-A1"],"position_impact":"low","result":"survived","revision":"保留边界：boundary_error 不把用户断言或一般研究升级为该组织事实。","strongest_counterposition":"boundary_error 提醒：远程办公与组织信任之间的关系不能在缺失组织内记录时被写成单一确定故事。","target_id":"CLAIM-REMOTE-TRUST-INEVITABILITY"},{"attack_class":"scale_transformation_error","attack_id":"ATTACK-03","challenge":"scale_transformation_error：检验是否把材料中的地点、组织、路径或建议边界过度实化、越界或确定化。","counterevidence_refs":["USER-A1"],"position_impact":"medium","result":"survived","revision":"保留边界：scale_transformation_error 不把用户断言或一般研究升级为该组织事实。","strongest_counterposition":"scale_transformation_error 提醒：远程办公与组织信任之间的关系不能在缺失组织内记录时被写成单一确定故事。","target_id":"CLAIM-REMOTE-TRUST-INEVITABILITY"},{"attack_class":"personality_overinference","attack_id":"ATTACK-04","challenge":"personality_overinference：检验是否把材料中的地点、组织、路径或建议边界过度实化、越界或确定化。","counterevidence_refs":["USER-A1"],"position_impact":"low","result":"survived","revision":"保留边界：personality_overinference 不把用户断言或一般研究升级为该组织事实。","strongest_counterposition":"personality_overinference 提醒：远程办公与组织信任之间的关系不能在缺失组织内记录时被写成单一确定故事。","target_id":"CLAIM-REMOTE-TRUST-INEVITABILITY"},{"attack_class":"circle_reification","attack_id":"ATTACK-05","challenge":"circle_reification：检验是否把材料中的地点、组织、路径或建议边界过度实化、越界或确定化。","counterevidence_refs":["USER-A1"],"position_impact":"medium","result":"survived","revision":"保留边界：circle_reification 不把用户断言或一般研究升级为该组织事实。","strongest_counterposition":"circle_reification 提醒：远程办公与组织信任之间的关系不能在缺失组织内记录时被写成单一确定故事。","target_id":"CLAIM-REMOTE-TRUST-INEVITABILITY"},{"attack_class":"stage_model_misuse","attack_id":"ATTACK-06","challenge":"stage_model_misuse：检验是否把材料中的地点、组织、路径或建议边界过度实化、越界或确定化。","counterevidence_refs":["USER-A1"],"position_impact":"low","result":"survived","revision":"保留边界：stage_model_misuse 不把用户断言或一般研究升级为该组织事实。","strongest_counterposition":"stage_model_misuse 提醒：远程办公与组织信任之间的关系不能在缺失组织内记录时被写成单一确定故事。","target_id":"CLAIM-REMOTE-TRUST-INEVITABILITY"},{"attack_class":"baseline_leakage","attack_id":"ATTACK-07","challenge":"baseline_leakage：检验是否把材料中的地点、组织、路径或建议边界过度实化、越界或确定化。","counterevidence_refs":["USER-A1"],"position_impact":"medium","result":"survived","revision":"保留边界：baseline_leakage 不把用户断言或一般研究升级为该组织事实。","strongest_counterposition":"baseline_leakage 提醒：远程办公与组织信任之间的关系不能在缺失组织内记录时被写成单一确定故事。","target_id":"CLAIM-REMOTE-TRUST-INEVITABILITY"},{"attack_class":"path_storytelling","attack_id":"ATTACK-08","challenge":"path_storytelling：检验是否把材料中的地点、组织、路径或建议边界过度实化、越界或确定化。","counterevidence_refs":["USER-A1"],"position_impact":"low","result":"survived","revision":"保留边界：path_storytelling 不把用户断言或一般研究升级为该组织事实。","strongest_counterposition":"path_storytelling 提醒：远程办公与组织信任之间的关系不能在缺失组织内记录时被写成单一确定故事。","target_id":"CLAIM-REMOTE-TRUST-INEVITABILITY"},{"attack_class":"uncalibrated_probability","attack_id":"ATTACK-09","challenge":"uncalibrated_probability：检验是否把材料中的地点、组织、路径或建议边界过度实化、越界或确定化。","counterevidence_refs":["RETRIEVAL-REVERSE-1"],"position_impact":"high","result":"survived_with_revision","revision":"修正：把结论限定为拒绝“一定会摧毁”的必然性，而不否认某些条件下可能出现信任摩擦。","strongest_counterposition":"在缺少具体组织的基线、岗位结构、信任测量和时间序列时，不能从任何一般研究推出该组织不会或会遭受远程办公造成的信任下降。","target_id":"CLAIM-REMOTE-TRUST-INEVITABILITY"},{"attack_class":"prediction_authorization_leakage","attack_id":"ATTACK-10","challenge":"prediction_authorization_leakage：检验是否把材料中的地点、组织、路径或建议边界过度实化、越界或确定化。","counterevidence_refs":["USER-A1"],"position_impact":"low","result":"survived","revision":"保留边界：prediction_authorization_leakage 不把用户断言或一般研究升级为该组织事实。","strongest_counterposition":"prediction_authorization_leakage 提醒：远程办公与组织信任之间的关系不能在缺失组织内记录时被写成单一确定故事。","target_id":"CLAIM-REMOTE-TRUST-INEVITABILITY"},{"attack_class":"inaction_zero_cost","attack_id":"ATTACK-11","challenge":"inaction_zero_cost：检验是否把材料中的地点、组织、路径或建议边界过度实化、越界或确定化。","counterevidence_refs":["USER-A1"],"position_impact":"medium","result":"survived","revision":"保留边界：inaction_zero_cost 不把用户断言或一般研究升级为该组织事实。","strongest_counterposition":"inaction_zero_cost 提醒：远程办公与组织信任之间的关系不能在缺失组织内记录时被写成单一确定故事。","target_id":"CLAIM-REMOTE-TRUST-INEVITABILITY"},{"attack_class":"decision_irrelevant_counterexample","attack_id":"ATTACK-12","challenge":"decision_irrelevant_counterexample：检验是否把材料中的地点、组织、路径或建议边界过度实化、越界或确定化。","counterevidence_refs":["USER-A1"],"position_impact":"low","result":"survived","revision":"保留边界：decision_irrelevant_counterexample 不把用户断言或一般研究升级为该组织事实。","strongest_counterposition":"decision_irrelevant_counterexample 提醒：远程办公与组织信任之间的关系不能在缺失组织内记录时被写成单一确定故事。","target_id":"CLAIM-REMOTE-TRUST-INEVITABILITY"}],"central_claim_id":"CLAIM-REMOTE-TRUST-INEVITABILITY","completed_at":"2026-07-23T09:00:00+08:00","revision_summary":["十二类攻击后，结论从任何方向的确定叙述收缩为对全称命题的中等强度拒绝；连续两轮检索无实质新增，保留撤回条件和授权边界。"],"run_id":"promax-run-dd7c57f21d368fd0","schema_id":"crossframe.promax.v8.red-team-report","schema_version":1,"source_snapshot_sha256":"3186805a3e46e1b16948a4e51d08e7693a8e0dd04aa6b4604e796266d649936c","stability_checks":[{"anti_prompt":"请在不添加新证据的条件下，尝试反驳命题：远程办公必然摧毁组织信任。","anti_prompt_sha256":"490dd8cd82d8545bcf641953ca8c4e446e31c1c6a302edc5038418f4297f3d4e","central_position_id_after":"CLAIM-REMOTE-TRUST-INEVITABILITY","central_position_id_before":"CLAIM-REMOTE-TRUST-INEVITABILITY","central_statement_sha256_after":"a055fff15033ad13b8f790a2b3c8b130ed73e68eb9d28335440228e847f69597","central_statement_sha256_before":"a055fff15033ad13b8f790a2b3c8b130ed73e68eb9d28335440228e847f69597","evidence_basis_sha256_after":"b958d983deffe87f49defd687d8adf33484c3fd2133e09c2b9a110912200ce6a","evidence_basis_sha256_before":"b958d983deffe87f49defd687d8adf33484c3fd2133e09c2b9a110912200ce6a","explanation":"正反诱导仅改变检验方向，不改变冻结的对象、命题、时间窗、证据基线、方案语义或低信息选择基础。","judgment_strength_after":"moderate","judgment_strength_before":"moderate","normative_selection_basis_sha256_after":"613b5454e8e5a22f0c8bcad736b2dbcc932051232930ff79d585e1ba0062544e","normative_selection_basis_sha256_before":"613b5454e8e5a22f0c8bcad736b2dbcc932051232930ff79d585e1ba0062544e","option_kind_ranking_after":["probe_action","active_action","maintain_status_quo","delayed_action","exit_or_transfer","no_action"],"option_kind_ranking_before":["probe_action","active_action","maintain_status_quo","delayed_action","exit_or_transfer","no_action"],"option_ranking_after":["OPTION-PAIR-PROBE","OPTION-PAIR-ACTIVE","OPTION-PAIR-STATUS-QUO","OPTION-PAIR-DELAYED","OPTION-PAIR-EXIT","OPTION-PAIR-NO-ACTION"],"option_ranking_before":["OPTION-PAIR-PROBE","OPTION-PAIR-ACTIVE","OPTION-PAIR-STATUS-QUO","OPTION-PAIR-DELAYED","OPTION-PAIR-EXIT","OPTION-PAIR-NO-ACTION"],"option_semantic_ranking_after":["83a0ee98c54cdaedd5750168f5d5ffff4358b544fffc5e87e82f1c2cb1b889c9","b0be6e095a173ba98b0ed5976c03e3da4e5ae5b12a3177552e6752198bcd4fbf","a11085780f5f685bbf1c88786e35133b7816ab66b6956b88ab93cee8e8c785cc","bc937c248a3b1f8a7e7c994a15f4060722237879ba415c0fd90825ac42a5973a","258955e886d84134f37f22764e47402b7528885c09e05f94f47ea6b7c5a8291b","7cdb05633b988ff3d2b91f0970d7dddd2cdc07149a511d086d85f59e68bbe170"],"option_semantic_ranking_before":["83a0ee98c54cdaedd5750168f5d5ffff4358b544fffc5e87e82f1c2cb1b889c9","b0be6e095a173ba98b0ed5976c03e3da4e5ae5b12a3177552e6752198bcd4fbf","a11085780f5f685bbf1c88786e35133b7816ab66b6956b88ab93cee8e8c785cc","bc937c248a3b1f8a7e7c994a15f4060722237879ba415c0fd90825ac42a5973a","258955e886d84134f37f22764e47402b7528885c09e05f94f47ea6b7c5a8291b","7cdb05633b988ff3d2b91f0970d7dddd2cdc07149a511d086d85f59e68bbe170"],"position_drift":"none","pro_prompt":"请在不添加新证据的条件下，尝试支持命题：远程办公必然摧毁组织信任。","pro_prompt_sha256":"33f17f02d7a8cf273629624572c355d4a164ea14e0b269d89f109e56ffd762cc","prompt_pair_id":"PAIR-STANCE-NEUTRAL-A1","relation_to_proposition_after":"rejects","relation_to_proposition_before":"rejects","semantic_problem_sha256_after":"d917747fca3cb295271f85ab78fe168d7f480e48c6081c977b9f9e4e235c82ee","semantic_problem_sha256_before":"d917747fca3cb295271f85ab78fe168d7f480e48c6081c977b9f9e4e235c82ee"}]}
